{
  "schema_version": "1.0",
  "time_s": 12.5,
  "seed": 184729,
  "agents": [
    {
      "id": "Porpoise_001",
      "species": "harbour_porpoise",
      "state": "shallow_swim",
      "position_m": [125.4, -0.8, 456.1],
      "heading_deg": 217.3,
      "speed_mps": 2.4,
      "depth_m": 0.8
    }
  ]
}
